"slug","title_en","title_fr","title_ar","excerpt_fr","excerpt_ar","sources","image_url","image_name","langs","published_at","extracted_at","deadline","rubrique_website","themes","organizations","content_fr","content_ar","content_html"
"kyber-teatro-call-for-work-on-the-interaction-between-theatre-and-new-technologies-italy-qfxsvx","Kyber Teatro: Call for Work on the Interaction Between Theatre and New Technologies (Italy)","","","","","https://on-the-move.org/news/kyber-teatro-call-work-interaction-between-theatre-and-new-technologies-italy","https://on-the-move.org/sites/default/files/styles/article_desktop_1x/public/news/2022-11/leme.jpg?itok=cs9BPSFk","","EN","2022-11-29 08:00:00","2022-12-26 11:35:09","2023-03-15 23:59:00","culture","culture","","","","<div id=block-otm-content class=""block block-system block-system-main-block""><article role=article about=/news/kyber-teatro-call-work-interaction-between-theatre-and-new-technologies-italy class=""node node--type-news-calls node--promoted node--view-mode-full""><div class=node__content><div class=""clearfix text-formatted field field--name-body field--type-text-with-summary field--label-hidden field__item""><p>During October and November 2023, Kyber Theatre in Cagliari (Italy) will organise the 10th edition of the International Theatre, Art and New Technologies Festival ‘The Wonders of Possible’.</p><p><span class=caps>LMDP</span> Festival is the first of its kind in the whole Italy. Its aim is to promote the interrelation between artistic and technological languages.</p><p>This call invites Italian and international artists and companies (maximum 3 people), whether emerging or established, to submit projects around the theme of the ‘interaction between theatre and new technologies’.</p><p>Eligible projects:</p><ul><li>Theatre and new technologies plays.</li><li>Art and new technologies performances.</li></ul><p>The winners of the open call will have<strong> full coverage of the costs of mobility (flights, board and accommodation in Cagliari) </strong>and an ‘attendance fee’ for the presentation of their performance for two evenings. If possible, the festival will also cover any material required for the presentation of the performance/show/play (subject to agreement with the technical director). </p></div></div></article></div>"
"faki-festival-open-call-for-artists-activists-researchers-and-theatre-critics-croatia-zwrmzj","FAKI Festival: Open Call for Artists, Activists, Researchers and Theatre Critics (Croatia)","","","","","https://on-the-move.org/news/faki-festival-open-call-artists-activists-researchers-and-theatre-critics-croatia","https://on-the-move.org/sites/default/files/styles/article_desktop_1x/public/news/2022-11/faki-festival-radical-love.jpg?itok=uCC9LpBb","","EN","2022-11-28 08:00:00","2022-12-26 11:35:10","2022-12-28 23:59:00","culture","culture","","","","<div id=block-otm-content class=""block block-system block-system-main-block""><article role=article about=/news/faki-festival-open-call-artists-activists-researchers-and-theatre-critics-croatia class=""node node--type-news-calls node--promoted node--view-mode-full""><div class=node__content><div class=""clearfix text-formatted field field--name-body field--type-text-with-summary field--label-hidden field__item""><p><span class=caps>FAKI</span> Festival – International Festival of Alternative Theatrical Expression is calling for artists, activists, researchers and theatre critics to participate in its next edition happening in Zagreb, Croatia in May 2023. </p><p>In a world that too often confuses love and violence, we need to ask ourselves: how can we live in a deeper, respectful relationship with each other and with our planet?</p><p>The 26th edition of <span class=caps>FAKI</span> Festival of Alternative Theatrical Expression enacts the theme of <span class=caps>RADICAL</span> <span class=caps>LOVE</span>, touching a yearning we all have. Love is a vital pulse in our lives. And yet, the strength of our desire for it rarely leads us to radically change the way we love. No matter how committed we are to love, our efforts seem to resemble a wishful fantasy. </p><p><span class=caps>FAKI</span> Festival invites proposals for plays, physical theatre, contemporary dance and circus, performances for children, site-specific performances, slam poetry, manifestos, lecture-performances, short films, installations, workshops, or any other forms of expression. They are open to all genres, formats and durations and consider work in progress and finished creations as equal. Proposals for short (one-week) residencies for development are also welcome. </p><p><span class=caps>FAKI</span> Festival covers:</p><ul><li><strong>Travel costs up to 200€ for individuals and up to 400€ for groups, with preference given to sustainable means of transport (bus, train, shared car).</strong></li><li>Subsistence – shared accommodation on-site at Medika and healthy vegan lunches during the festival.</li><li>Basic technical support (light, sound, and other wonders).</li><li>Photo and video documentation of the performances.</li><li>Public relations and media presence via the festival network.</li><li>Rehearsal space / residency (if needed).</li><li>Dramaturgy support and/or feedback (if needed).</li></ul><p>Artist and other guest fees / production costs unfortunately cannot be covered due to limited financial resources. The festival will work together with their guests to find funding from other sources (via letters of support or other means).</p></div></div></article></div>"
"les-jardins-d-etretat-art-residency-on-the-alabaster-coast-france-fzocpr","Les Jardins d'Étretat: Art Residency on the Alabaster Coast (France)","","","","","https://on-the-move.org/news/les-jardins-detretat-art-residency-alabaster-coast-france","https://on-the-move.org/sites/default/files/styles/article_desktop_1x/public/news/2022-11/les-jardins.jpeg?itok=UT7YVW7V","","EN","2022-11-28 08:00:00","2022-12-26 11:35:10","2022-12-30 23:59:00","culture","culture","","","","<div id=block-otm-content class=""block block-system block-system-main-block""><article role=article about=/news/les-jardins-detretat-art-residency-alabaster-coast-france class=""node node--type-news-calls node--promoted node--view-mode-full""><div class=node__content><div class=""clearfix text-formatted field field--name-body field--type-text-with-summary field--label-hidden field__item""><p>Les Jardins d’Étretat in Normandy, France is calling for applications for an art residency in the spring of 2023. The participants are invited to create a site-specific installation that will take place in the topiary space of the Gardens from May 2023 to December 2024 on the cliff of the Alabaster Coast.</p><p>The residency is open to visual artists, architects and collectives of multidisciplinary artists residing in Europe. Authors working on site-specific projects and land art, as well as with immersive and interactive practices, are particularly welcome to apply.</p><p>Successful candidates will be hosted at the Roxelane Villa and have the opportunity to immerse themselves in the local context right in the heart of Les Jardins d’Étretat. The famous view of the Amont cliff on the English Channel and the arch in the bay of Étretat have inspired masters of Impressionism, writers Guy de Maupassant and Maurice Leblanc, composer Jacques Offenbach, and many others. The residency invites artists to interpret the encounter between the contemporary garden, its architecture, philosophy and history of the site, its natural and artistic heritage, and express it in their final work. The installation will be seen by more than 100,000 viewers visiting Les Jardins d’Étretat each year.</p><p>The selected candidates will benefit from:</p><ul><li>Full board accommodation at the Roxelane Villa for 3 weeks (between March and May 2023).</li><li>Transfer from/ to Paris (train ticket + car journey to Étretat).</li><li>Travel to the surrounding areas of Étretat to carry out artist-led research as part of the preparation of the project (once a week at the request of the artist).</li><li><strong>Production budget for the in situ installation is capped at 12,000 Euros. (Production fees can be used for travel with the agreement of the organisers.)</strong></li></ul><p>The artists are expected to plan their activities during the residency taking into account weekly meetings with local actors and audiences. During research-gathering and project planning, the artist is expected to liaise with the team of Les Jardins d’Étretat on site and become familiar with the garden’s rhythm of life: change of seasons, rain and watering, influence of wind, etc. This research will culminate in the delivery of an installation with the artist being present at the opening.</p></div></div></article></div>"
"new-curators-curatorial-training-programme-for-individuals-from-lower-socio-economic-backgrounds-uk-ynjdbm","New Curators: Curatorial Training Programme for Individuals from Lower Socio-economic Backgrounds (UK)","","","","","https://on-the-move.org/news/new-curators-curatorial-training-programme-individuals-lower-socio-economic-backgrounds-uk","https://on-the-move.org/sites/default/files/styles/article_desktop_1x/public/news/2022-11/new-curators.jpg?itok=4rpKl_IN","","EN","2022-11-28 08:00:00","2022-12-26 11:35:11","2023-02-05 23:59:00","culture","culture","","","","<div id=block-otm-content class=""block block-system block-system-main-block""><article role=article about=/news/new-curators-curatorial-training-programme-individuals-lower-socio-economic-backgrounds-uk class=""node node--type-news-calls node--promoted node--view-mode-full""><div class=node__content><div class=""clearfix text-formatted field field--name-body field--type-text-with-summary field--label-hidden field__item""><p>New Curators is a paid twelve-month curatorial training programme based in London for individuals from lower socio-economic backgrounds. It will start in September 2023.</p><p>Training to become a curator is expensive and entering the profession can be difficult. Little wonder the industry is often seen as elitist and characterised by a lack of diversity. This programme aims to help make the art world more accessible and equitable in order to make it richer and more relevant.</p><p>By offering an intensive twelve-month curatorial training and London living wage to 12 people from lower socio-economic backgrounds globally, New Curators will help diversify the curatorial profession.</p><p><strong>New Curators will pay every participant the Real Living Wage, which is an hourly rate of pay (currently £11.95/hour for London) set independently and calculated according to the basic cost of living in the <span class=caps>UK</span>. </strong>The Real Living Wage is updated annually, and employers choose to pay the Living Wage on a voluntary basis. Participants will receive a full-time employment contract for 12-months.</p><p>International applicants requiring a visa to enter the <span class=caps>UK</span> must have an undergraduate degree awarded within the last three years or be currently enrolled on a degree-level course to meet the Tier 5 visa requirements. Qualifications and institutions must be recognised by <span class=caps>UK</span> <span class=caps>NARIC</span>.</p><p><strong>As part of the programme participants will visit associated organisations in the <span class=caps>UK</span> in person, in addition to one fully funded organised international trip.</strong></p></div></div></article></div>"
"la-foret-monumentale-call-for-on-site-installation-artworks-in-the-roumare-forest-france-xqotgk","La Forêt Monumentale: Call for On-site Installation Artworks in the Roumare Forest (France)","","","","","https://on-the-move.org/news/la-foret-monumentale-call-site-installation-artworks-roumare-forest-france","https://on-the-move.org/sites/default/files/styles/article_desktop_1x/public/news/2022-11/foret-monumentale.jpeg?itok=X2RvuQOh","","EN","2022-11-25 08:00:00","2022-12-26 11:35:12","2023-02-27 23:59:00","culture","culture","","","","<div id=block-otm-content class=""block block-system block-system-main-block""><article role=article about=/news/la-foret-monumentale-call-site-installation-artworks-roumare-forest-france class=""node node--type-news-calls node--promoted node--view-mode-full""><div class=node__content><div class=""clearfix text-formatted field field--name-body field--type-text-with-summary field--label-hidden field__item""><p>Métropole Rouen Normandie is teaming up with <span class=caps>ONF</span> to host the Forêt Monumentale exhibition. This event is a two-year art exhibition that takes the form of a trail of monumental artworks, to be created in the Roumare Forest.</p><p>This unique trail of several kilometres offers visitors an opportunity to visit this remarkable natural habitat, or to see it from a different angle. It invites them to explore a stretch of woodland dotted with pieces created by plastic artists, landscapers, artists, designers and architects who have plunged themselves into these green lungs to experiment with new art forms. </p><p>The second Forêt Monumentale exhibition will open in June 2024 in the Roumare forest in Canteleu, near Rouen. It will end in 2026. </p><p>This call for creations will select a total of 9 artworks for installation in the forest along a 4-kilometre trail at various sites. A first phase will see around 20 candidates selected for <strong>a grant of 2000 <span class=caps>EUR</span> to elaborate their proposals</strong>. The final 9 projects will then be chosen to each receive <strong>25,000 <span class=caps>EUR</span> to produce and then install their artwork</strong> between November 2023 – June 2024.</p><p>This call for creations is open to professionals and students of all creative disciplines: French and international artists, designers, architects, landscapers, performers, plastic artists, graphic designers, etc. Participants may be individuals or groups.</p></div></div></article></div>"
"national-centre-for-writing-literary-translation-residency-uk-ixjrah","National Centre for Writing: Literary Translation Residency (UK)","","","","","https://on-the-move.org/news/national-centre-writing-literary-translation-residency-uk","https://on-the-move.org/sites/default/files/styles/article_desktop_1x/public/news/2022-11/national-centre-writing.jpeg?itok=Xe8jDyyy","","EN","2022-11-25 08:00:00","2022-12-26 11:35:14","2023-01-09 23:59:00","culture","culture","","","","<div id=block-otm-content class=""block block-system block-system-main-block""><article role=article about=/news/national-centre-writing-literary-translation-residency-uk class=""node node--type-news-calls node--promoted node--view-mode-full""><div class=node__content><div class=""clearfix text-formatted field field--name-body field--type-text-with-summary field--label-hidden field__item""><p>The National Centre for Writing in Norwich, England is partnering with the <span class=caps>RECIT</span> network and the Translation in Motion consortium to offer a month-long residency in Norwich in May 2023 to one or two literary translators working from English into the languages of the countries of the Western Balkans – Albania, Bosnia and Herzegovina, Kosovo, Montenegro, North Macedonia and Serbia. </p><p>These residencies are open to <span class=caps>UK</span> and <span class=caps>EU</span> translators working from the languages of the Western Balkans into English. The <span class=caps>NCW</span> are particularly keen to welcome translators interested in translating contemporary British writing.</p><p>The translators from the Western Balkans will be hosted in the Dragon Hall cottage in Norwich for four weeks in May 2023. They will receive a stipend for living expenses for the month, and they will be <strong>reimbursed for the cost of economy class travel to Norwich</strong>.</p></div></div></article></div>"
"allianz-foundation-climate-cultures-call-hwmtus","Allianz Foundation: Climate Cultures Call","","","","","https://on-the-move.org/news/allianz-foundation-climate-cultures-call","https://on-the-move.org/sites/default/files/styles/article_desktop_1x/public/news/2022-11/allianz-foundation.jpg?itok=nB1CiGVq","","EN","2022-11-25 08:00:00","2022-12-26 11:35:15","2023-01-01 23:59:00","culture","culture","","","","<div id=block-otm-content class=""block block-system block-system-main-block""><article role=article about=/news/allianz-foundation-climate-cultures-call class=""node node--type-news-calls node--promoted node--view-mode-full""><div class=node__content><div class=""clearfix text-formatted field field--name-body field--type-text-with-summary field--label-hidden field__item""><p>In order to be able to effectively counteract climate change, we need to change our mindset. What is needed are holistic approaches that take into account the connection between global warming and social climate – and from this obtain incentives for the urgently needed transformation of our cultural practices and paradigms. Along with the ecological aspects, consequences of the climate crisis such as social upheaval, displacement and migration, and growing nationalism must also be considered.</p><p>The Allianz Foundation’s Climate Cultures Call supports projects and initiatives that are situated at the intersection between climate and culture, and work toward sustainable solutions for open societies and a healthy and habitable planet.</p><p>The open call is aimed at actors from the civil society, arts and culture, and environmental protection sectors. Allianz Foundation explicitly welcome applications from members of younger generations as well as from people or organisations that work across borders and/or do outreach work with target groups that are especially diverse.</p><p>Ten projects will be funded in which artists, cultural workers, activists, environmentalists, citizens’ initiatives, <span class=caps>NGO</span>s, scientists, start-ups or urban planners from Europe and the Mediterranean establish alliances for a new climate culture.</p><p>Allianz Foundation are looking for projects: </p><ul><li>That establish new alliances for fighting the climate crisis in a way that includes social and cultural perspectives.</li><li>That create new narratives that make the necessary socio-ecological change tangible as a benefit and motivate more people to take action for the climate.</li><li>That include many voices and take intersectional, cross-generational or postcolonial perspectives into account, among others.</li><li>That raise questions about justice for the societies of the present and for future generations.</li></ul><p><strong>Projects can be funded for up to 50,000 euros. </strong>The funding period is 15 March - 31 December 2023. The Climate Cultures Call is a special call responding to the urgency of the current challenges. The applications are quickly reviewed, and funding will be awarded expediently. If we don’t act today, the risks for the future will become incalculable.</p></div></div></article></div>"
"british-council-uk-poland-arts-scoping-grants-fcmrep","British Council: UK-Poland Arts Scoping Grants","","","","","https://on-the-move.org/news/british-council-uk-poland-arts-scoping-grants","https://on-the-move.org/sites/default/files/styles/article_desktop_1x/public/news/2022-11/british-council.jpeg?itok=BrQrb-ET","","EN","2022-11-24 08:00:00","2022-12-26 11:35:16","2023-01-04 23:59:00","culture","culture","","","","<div id=block-otm-content class=""block block-system block-system-main-block""><article role=article about=/news/british-council-uk-poland-arts-scoping-grants class=""node node--type-news-calls node--promoted node--view-mode-full""><div class=node__content><div class=""clearfix text-formatted field field--name-body field--type-text-with-summary field--label-hidden field__item""><p>The British Council has opened applications for scoping grants in preparation for a proposed <span class=caps>UK</span>/Poland season in 2025. In order to start developing potential activity, they are offering <strong>grants of £2500</strong> to start conversations and establish partnerships. </p><p>The grants are primarily for travel-related costs (flights, train, accommodation), to support travel related costs for representatives of <span class=caps>UK</span> and Polish organisations in the arts and creative industries to undertake scoping visits to each other’s country. British Council are keen to support the creation of new work, new collaborations, and innovative activity. All applicants should have a clear project in mind which would then be collaboratively developed through this exchange. The project must be for ultimate presentation in Poland, or in Poland and <span class=caps>UK</span>, but not <span class=caps>UK</span> only.</p><p>In late 2023 and 2024 British Council are hoping to offer additional funding to support the strongest collaborations which best meet the aims of the planned Season. Projects should be delivered by at least one <span class=caps>UK</span>-based organisation and at least one organisation based in Poland. Only one of the two organisations can apply for the grant. British Council will not fund legacy activity or recurrent costs on existing projects. There are a total of 25 grants available this year. The travel should take place between February and May 2023. </p><p>In certain circumstances, the British Council might consider a non-travel application if there is strong evidence that the grant would be put to good use in developing the project idea without physically visiting the country.</p><p>The grants are open to arts and cultural organisations, large or small, in both <span class=caps>UK</span> and Poland. If the proposed project is clearly shared between two organisations then only one of the organisations can apply for the grant. The grants are not open to individual artists, although a curator may be considered if the project is strong enough. </p></div></div></article></div>"
"alter-trandisciplinary-residency-programme-in-the-swiss-alps-switzerland-qqivni","ALTER-: Trandisciplinary Residency Programme in the Swiss Alps (Switzerland)","","","","","https://on-the-move.org/news/alter-trandisciplinary-residency-programme-swiss-alps-switzerland","https://on-the-move.org/sites/default/files/styles/article_desktop_1x/public/news/2022-11/alter.jpeg?itok=mUrVBQQN","","EN","2022-11-22 08:00:00","2022-12-26 11:35:17","2022-12-31 23:59:00","culture","culture","","","","<div id=block-otm-content class=""block block-system block-system-main-block""><article role=article about=/news/alter-trandisciplinary-residency-programme-swiss-alps-switzerland class=""node node--type-news-calls node--promoted node--view-mode-full""><div class=node__content><div class=""clearfix text-formatted field field--name-body field--type-text-with-summary field--label-hidden field__item""><p><span class=caps>ALTER</span>- is a 2-3 month residency in Chandolin, a village perched at an altitude of 2000 meters in the Val d’Anniviers, that invites one transdisciplinary team of artists and researchers a year to rethink and respond to growing environmental crises and their associated social, economic, and cultural shifts. Each team will spend nine to twelve weeks exploring the valley, learning from local villagers, developing work that will be publicly shared on a weekly basis, and presenting a final project. While the residency builds on this locale, the work and wisdom generated by each team could have far-reaching implications for high-mountain communities around the world.</p><p>What’s happening to the cycle of seasons in the Alps as the frozen earth thaws? How will the loss of glaciers affect water availability for farming and hydroelectricity? How do the inhabitants of the valley revive and transmit intangible heritage such as the gathering and cultivation of wild plants? What is gone, and what has taken its place? How can we live together with more-than-humans in the land we share?</p><p>This is just a sample of questions <span class=caps>ALTER</span>-, a three-month residency responding to the environmental crises in the Alps, invites each team selected annually to explore. Now, more than ever, we need transdisciplinary artists and researchers to challenge our perceptions of the rapidly evolving climate paradigm and motivate us to find new knowledge and new ways of living.</p><p>The next residency will take place either for 3 months from 5 June – 30 August 2023 or for 2 months from 3 July – 30 August 2023. Applications are open only to collectives of 3 to 5 people, already formed and transdisciplinary. The residency is open to all transdisciplinary teams, regardless of age or nationality. Teams can come from anywhere in the world; <span class=caps>ALTER</span>- encourages those who have already developed research and work in mountain regions to apply. </p><p><strong>Support from the residency includes accommodation and a monthly stipend of 1500 <span class=caps>CHF</span> (~1525 <span class=caps>EUR</span>) per person.</strong></p></div></div></article></div>"
