"slug","title_en","title_fr","title_ar","excerpt_fr","excerpt_ar","sources","image_url","image_name","langs","published_at","extracted_at","deadline","rubrique_website","themes","organizations","content_fr","content_ar","content_html"
"yao-collaborative-digital-diasporas-residencies-remote-jywpvw","yáo collaborative: Digital Diasporas Residencies (Remote)","","","","","https://on-the-move.org/news/yao-collaborative-digital-diasporas-residencies-remote","https://on-the-move.org/sites/default/files/styles/article_desktop_1x/public/news/2022-12/digital-diasporas.png?itok=TefSWlAn","","EN","2022-12-16 08:00:00","2022-12-26 11:34:41","2023-02-15 23:59:00","culture","culture","","","","<div id=block-otm-content class=""block block-system block-system-main-block""><article role=article about=/news/yao-collaborative-digital-diasporas-residencies-remote class=""node node--type-news-calls node--promoted node--view-mode-full""><div class=node__content><div class=""clearfix text-formatted field field--name-body field--type-text-with-summary field--label-hidden field__item""><p>In 2021 yáo collaborative (formerly China Residencies) launched the first iteration of the Digital Diasporas, a distributed, remote residency which gave artists the space to research, cultivate their practice, and convene across borders. Last year’s residents Tian Zhang, Amy Lam, and Casey Tang inspired many generative conversations and long-lasting connections about colonialisms in multiple contexts, sustainability and equity in arts practices, and all the ways in which we (human, non-human, and ecological) coexist in all our relations.</p><p>Digital Diasporas was a spacious opportunity for artists to do deep thinking and form cross-border connections without the pressure of producing a final product. This year, the open call returns for a second iteration with an additional residency host in the United States.</p><p>The programme seeks artists, collectives, and curators who self-identify and find it useful to gather under a ‘Sino and/or Chinese diaspora’ cohort. This is a time for research, exploration and learning, and for openness to collective, intercultural and cross-border development and research.</p><p>The organisers welcome experimental, digital, and/or research-based practices, and people who feel an alignment with and interest in any or all of the host organisations’ networks and programming. They are especially interested in ideas that explore diasporic cultures and spaces, flows of people, goods and capital, alternative community and kin-making, digital cultures, media arts, philosophies of technology and place-making – and any intersections of these.</p><p>Digital Diasporas will host:</p><ul><li>One person or collective who self-identifies as Chinese and/or Sino diaspora in or from Australia (citizen or permanent resident).</li><li>One person or collective who self-identifies as Chinese and/or Sino diaspora in or from Canada (citizen or permanent resident).</li><li>One person or collective who self-identifies as Chinese and/or Sino, regardless of what passport they hold or where they reside.</li></ul><p>The remote, six-week-long online residency will be facilitated by three host organisations in May and June. Each resident or collective will primarily work with one host organisation in Australia, Canada, or the United States and all residents as a cohort will be in dialogue with one another through convenings. <strong>Each resident or collective will be awarded an unrestricted stipend of <span class=caps>AUD</span> $10,000 for their participation (<span class=caps>CAD</span> $10,000 for the Gendai Resident). </strong>Each host organisation will design a programme of remote/online mentoring, networking, research and development for the resident they host. The host organisations are:</p><ul><li>4A Centre for Contemporary Asian Art (Sydney, Australia / the ancestral lands of the Gadigal people of the Eora Nation).</li><li>Gendai (Toronto, Canada / the ancestral territory of many nations including the Mississaugas of the Credit, the Anishnabeg, the Chippewa, the Haudenosaunee and the Wendat peoples and now home to many diverse First Nations, Inuit and Métis peoples).</li><li>Asian Arts Initiative (Philadelphia, <span class=caps>USA</span> / ancestral homelands of the Lenape peoples).</li></ul></div></div></article></div>"
"anna-lindh-foundation-alfinmotion-cross-sectoral-mobility-programme-for-the-mediterranean-jsmtlc","Anna Lindh Foundation: ALFinMOTION Cross-sectoral Mobility Programme for the Mediterranean","","","","","https://on-the-move.org/news/anna-lindh-foundation-alfinmotion-cross-sectoral-mobility-programme-mediterranean","https://on-the-move.org/sites/default/files/styles/article_desktop_1x/public/news/2022-12/alfinmotion.png?itok=wJR58Thx","","EN","2022-12-16 08:00:00","2022-12-26 11:34:41","2023-01-23 23:59:00","culture","culture","","","","<div id=block-otm-content class=""block block-system block-system-main-block""><article role=article about=/news/anna-lindh-foundation-alfinmotion-cross-sectoral-mobility-programme-mediterranean class=""node node--type-news-calls node--promoted node--view-mode-full""><div class=node__content><div class=""clearfix text-formatted field field--name-body field--type-text-with-summary field--label-hidden field__item""><p>In a post-Covid-19 recovery context the Anna Lindh Foundation is ensuring thriving Civil Society National Networks through <span class=caps>ALF</span>inMOTION, its interdisciplinary cross-sectoral mobility programme across the region. Capitalising on the diversity of the <span class=caps>ALF</span> on both shores of the Mediterranean, it supports collaborative initiatives aiming at strengthening equal partnerships.</p><p>Each mobility submission must be presented by a host organisation (applicant) and can involve, depending on the mobility modality, up to two hosted organisations from the complementary shore of the Mediterranean. Priority will be given to submissions where all the involved organisations are members of the Anna Lindh Foundation from the 41 National Networks and to submissions led by <span class=caps>ALF</span> members.</p><p><span class=caps>ALF</span>inMOTION is structured in four modalities that respond to the different needs encompassing intercultural dialogue – Action, Knowledge, Partnership and Creativity – with applying partnerships framing their submission under one of these headers. <strong>Budgets and minimum stays vary per modality, but range from 2 days to 1 month and from 1200 – 2200 <span class=caps>EUR</span>. </strong></p><p>To ensure enough time to meet visa requirements, the proposed mobilities under this call can take place anytime between April and September 2023. </p></div></div></article></div>"
"trans-europe-halles-senior-project-manager-researcher-sweden-pevhbm","Trans Europe Halles: Senior Project Manager / Researcher (Sweden)","","","","","https://on-the-move.org/news/trans-europe-halles-senior-project-manager-researcher-sweden","https://on-the-move.org/sites/default/files/styles/article_desktop_1x/public/news/2022-12/teh.jpg?itok=SJ__8eff","","EN","2022-12-15 08:00:00","2022-12-26 11:34:43","2022-12-31 23:59:00","culture","culture","","","","<div id=block-otm-content class=""block block-system block-system-main-block""><article role=article about=/news/trans-europe-halles-senior-project-manager-researcher-sweden class=""node node--type-news-calls node--promoted node--view-mode-full""><div class=node__content><div class=""clearfix text-formatted field field--name-body field--type-text-with-summary field--label-hidden field__item""><p>Trans Europe Halles is looking for a senior project manager / researcher to lead the Creative Europe ‘Cultural Transformation Movement’ project (Jan 2023 - Jan 2027).</p><p>Co-financed by the European Commission and led by the network Trans Europe Halles (<span class=caps>TEH</span>), The Cultural Transformation Movement Project (<span class=caps>CTMP</span>) is a four-year process that aims to diversify artistic production and its destination – starting from within the organisation itself. This will be achieved through generating and implementing strategies and methodologies of cultural management and creation processes developed with/by underrepresented communities (<span class=caps>URC</span>s). The project is led by <span class=caps>TEH</span> with its four members who are multidisciplinary art centres from Ukraine, Italy, Belgium and Austria. This project researches and examines two dimensions, one within and the other around the partner centres/organisations. It also questions the relationship between just art-making, policymaking, the context, and the resulting art forms.</p><p>The Cultural Transformation Movement project (<span class=caps>CTMP</span>) is the first project of the Cultural Transformation Movement (<span class=caps>CTM</span>). The movement is a larger working group of <span class=caps>TEH</span> members who are investing in the topics of social and spatial justice, and who have the ambition to reduce inequalities and inspire the European cultural sector on how to transform the organisations from within, in equal partnership with the under-represented communities around them.</p><p><span class=caps>CTMP</span> is a key strategic project for <span class=caps>TEH</span> and its success will determine a crucial area of work for the network: social and spatial sustainability.</p><p>As the project manager of the Cultural Transformation Movement Project (<span class=caps>CTMP</span>), you will:</p><ul><li>Be responsible for the successful delivery of the <span class=caps>CTMP</span></li><li>Develop and manage a detailed project plan in cooperation with the consortium.</li><li>Coordinate the <span class=caps>CTMP</span> consortium.</li><li>Be responsible for the quality control of all project deliverables submitted by the consortium members and other project stakeholders.</li><li>Collaborate with the <span class=caps>TEH</span> financial team to develop and submit the required technical and financial reports to the project.</li><li>Manage the project expenses and report to the financial manager, as well as coordinate with the project manager and financial managers of the partners.</li></ul><p>In addition the you will be expected to:</p><ul><li>Coordinate the <span class=caps>CTM</span> activities and co-produce public events and workshops with the <span class=caps>CTM</span> members.</li><li>Develop <span class=caps>TEH</span>’s relationship with the academic sector, be updated on the relevant academic literature on topics of social justice, spatial justice, Diversity, Equity and Inclusion (<span class=caps>DEI</span>) and relevant issues.</li><li>Understand the issues relevant to underrepresented communities and show a strong commitment to developing their active participation in our network.</li></ul><p>This is a four-year full-time position, based in Sweden with flexibility of 50% remote work. Start date is 1 February 2023, and <strong>gross salary is 31,250 <span class=caps>SEK</span></strong>.</p></div></div></article></div>"
"the-new-real-ai-art-commission-uncanny-machines-uk-acixse","The New Real: AI Art Commission, ‘Uncanny Machines’ (UK)","","","","","https://on-the-move.org/news/new-real-ai-art-commission-uncanny-machines-uk","https://on-the-move.org/sites/default/files/styles/article_desktop_1x/public/news/2022-12/new-real.jpg?itok=0bYwl1e5","","EN","2022-12-15 08:00:00","2022-12-26 11:34:44","2023-01-23 23:59:00","culture","culture","","","","<div id=block-otm-content class=""block block-system block-system-main-block""><article role=article about=/news/new-real-ai-art-commission-uncanny-machines-uk class=""node node--type-news-calls node--promoted node--view-mode-full""><div class=node__content><div class=""clearfix text-formatted field field--name-body field--type-text-with-summary field--label-hidden field__item""><p>The New Real have announced a new <span class=caps>AI</span> Art commissioning opportunity for an established creative practitioner (or practitioners) to work with their cross-disciplinary team, <span class=caps>AI</span> tools and textual data to develop a new <span class=caps>AI</span> Art work, for presentation with a festival/venue/presentation partner in 2023, that probes the uncanny interplay of humans and machines, and illuminates the social implications of recent developments in <span class=caps>AI</span>.</p><p>The commission will take place across 2023 beginning in February, with work in progress at events in March and May, and culminating in the launch of the work produced in Edinburgh in Summer/Autumn 2023.</p><p>The commission will take place across 2023 beginning in February, presenting concepts and/or work in progress at events in March (Stage 1) and May (Stage 2), and culminating in the launch of the work produced in Edinburgh in Summer/Autumn 2023. </p><p><strong>Stage 1 will award five artists £1000 each to develop a full project proposal and deliver a talk at a leading <span class=caps>AI</span> event. One of those artists will then be awarded £15,000 to develop a creative work using The New Real’s experiential <span class=caps>AI</span> platform and a British Library/Living With Machines dataset.</strong></p><p>The commission is open to artists/groups based in <span class=caps>UK</span>/Europe or no more than a short haul flight or equivalent land transit distance to Edinburgh - group applications including applicants outside this travel zone are welcome as long as one member of the group is within this zone and able to travel to participate in dissemination events. </p></div></div></article></div>"
"musee-du-quai-branly-jacques-chirac-sound-art-residency-france-nudako","Musée du quai Branly – Jacques Chirac: Sound Art Residency (France)","","","","","https://on-the-move.org/news/musee-du-quai-branly-jacques-chirac-sound-art-residency-france-0","https://on-the-move.org/sites/default/files/styles/article_desktop_1x/public/news/2022-04/quai-branly.jpeg?itok=gW__T9ay","","EN","2022-04-08 08:00:00","2022-12-26 11:34:45","2023-02-19 23:59:00","culture","culture","","","","<div id=block-otm-content class=""block block-system block-system-main-block""><article role=article about=/news/musee-du-quai-branly-jacques-chirac-sound-art-residency-france-0 class=""node node--type-news-calls node--promoted node--view-mode-full""><div class=node__content><div class=""clearfix text-formatted field field--name-body field--type-text-with-summary field--label-hidden field__item""><p>Musée du quai Branly – Jacques Chirac is launching the call for applications for its Sound Art Residency progamme.</p><p>The Sound Art Residency is open exclusively to artists who come from one of the four continents represented in the collections of the Musée du quai Branly - Jacques Chirac: Africa, Asia, Oceania and the Americas. There is no age limit to apply.</p><p>The jury will give precedence to pieces conceived in connection with the museum’s collections, interests and theme.</p><p>The winning project will be chosen in the spring of 2023 by an international jury that will bring together various personalities from the world of sound and audiovisual creation. The museum will pay the winning artist an endowment of €8000 and will also finance the production of the sound work, which will be presented to the public and may become part of the museum’s collections. <strong>Housing and travel for work sessions in Paris at the museum and at Le Fresnoy in Tourcoing will be covered on top of this grant.</strong></p><p>Timeline: </p><ul><li>May 2023 - February 2024: Research, creation, production with work session at the museum in Paris and Le Fresnoy in Tourcoing.</li><li>Mid-March 2024: End of the residency and public presentation of the piece.</li></ul></div></div></article></div>"
"house-on-fire-collabonation-grants-for-southern-african-music-artists-ajtyyb","House On Fire: CollaboNation Grants for Southern African Music Artists","","","","","https://on-the-move.org/news/house-fire-collabonation-grants-southern-african-music-artists","https://on-the-move.org/sites/default/files/styles/article_desktop_1x/public/news/2022-12/collabonation.jpg?itok=OklAzZll","","EN","2022-12-09 08:00:00","2022-12-26 11:34:47","2023-01-23 23:59:00","culture","culture","","","","<div id=block-otm-content class=""block block-system block-system-main-block""><article role=article about=/news/house-fire-collabonation-grants-southern-african-music-artists class=""node node--type-news-calls node--promoted node--view-mode-full""><div class=node__content><div class=""clearfix text-formatted field field--name-body field--type-text-with-summary field--label-hidden field__item""><p>Brought to you by House On Fire, the team behind the <span class=caps>MTN</span> Bushfire festival, CollaboNation offers artists from Eswatini, Botswana, Lesotho, Mozambique and Zimbabwe the opportunity to collaborate with each other to record original and inspirational songs, in line with the social values of <span class=caps>MTN</span> Bushfire.</p><p>CollaboNation will be a content and artist-driven journey, showcasing the creative and collaborative process of the artists before and during the song’s studio recording. The journey culminates in a live performance by the artists on the internationally celebrated stages at <span class=caps>MTN</span> Bushfire 2023, resulting in a complete, professional, music video. Distribution will be handled in partnership with the world-wide distributor Paradise Africa.</p><p>The aim is to extend the reach of Southern African artists, exposing them to new audiences, media, promoters and other industry professionals, in order to access new markets and communities while developing artist brands.</p><p>The grant is open to artists from eSwatini, Lesotho, Zimbabwe, Mozambique and Botswana for the opportunity to collaborate with each other to record original and inspirational songs, in line with the social and environmental values of House On Fire and the <span class=caps>MTN</span> Bushfire Festival. It seeks to extend the reach of Southern African artists, exposing them to new audiences, media, promoters and other industry professionals in order to access new markets and communities while developing artist brands.</p><p>House On Fire will provide:</p><ul><li><strong>Travel costs for the collaboration.</strong></li><li>Professionally recorded and produced song.</li><li>Professionally recorded and produced music video.</li><li>A distribution contract with Paradise Africa Distribution for the song.</li><li>International flighting of the music video on international <span class=caps>TV</span> stations.</li><li>Paid performance at the <span class=caps>MTN</span> Bushfire festival, in Eswatini.</li></ul></div></div></article></div>"
"artist-residency-in-the-old-mining-town-of-schwaz-austria-ximvfo","Artist Residency in the Old Mining Town of Schwaz (Austria)","","","","","https://on-the-move.org/news/artist-residency-old-mining-town-schwaz-austria","https://on-the-move.org/sites/default/files/styles/article_desktop_1x/public/news/2022-12/schwaz.jpg?itok=ngJulfhV","","EN","2022-12-09 08:00:00","2022-12-26 11:34:47","2023-01-31 23:59:00","culture","culture","","","","<div id=block-otm-content class=""block block-system block-system-main-block""><article role=article about=/news/artist-residency-old-mining-town-schwaz-austria class=""node node--type-news-calls node--promoted node--view-mode-full""><div class=node__content><div class=""clearfix text-formatted field field--name-body field--type-text-with-summary field--label-hidden field__item""><p>The city of Schwaz in Tyrol, Austria will be granting a residency to professional visual artists, media artists and curators in 2023.<br><br> An old mining town, Schwaz is surrounded by nature and has a wide range of cultural offerings in a concentrated area. It is an invitation to slow down one’s working process, to elaborate and delve more deeply into the development of a project. </p><p>The residency hopes to foster an intercultural dialogue in which the artistic process, research and production can be explored in juxtaposition with local themes. <br><br> A studio apartment as well as a studio/workroom will be available to the resident for a minimum of 4 to a maximum of 8 weeks. The planned period includes April and May 2023. The studio is centrally located in Innsbrucker Straße in Schwaz, directly in the Mathoi Haus (city archives). The apartment is within a few hundred metres of the studio in a beautiful location. <br><br> Additional to accommodation and studio facilities, the city of Schwaz will issue a stipend of €1500 per month over the duration of the residency to support artistic activities, up to a maximum of €3000 over a two-month stay. If the residency is terminated prematurely, the amount of support is reduced accordingly by the number of days. <strong>A travel subsidy of up to €200 is also available. </strong></p><p>Production costs or transport of art works to and from Schwaz are not covered. Working hours are at the resident’s discretion.</p></div></div></article></div>"
"markk-gerda-henkel-fellowship-programme-for-african-curators-and-scholars-germany-ciqhsk","MARKK: Gerda Henkel Fellowship-Programme for African Curators and Scholars (Germany)","","","","","https://on-the-move.org/news/markk-gerda-henkel-fellowship-programme-african-curators-and-scholars-germany","https://on-the-move.org/sites/default/files/styles/article_desktop_1x/public/news/2022-12/markk.jpg?itok=nVXHFxXl","","EN","2022-12-09 08:00:00","2022-12-26 11:34:48","2023-01-22 23:59:00","culture","culture","","","","<div id=block-otm-content class=""block block-system block-system-main-block""><article role=article about=/news/markk-gerda-henkel-fellowship-programme-african-curators-and-scholars-germany class=""node node--type-news-calls node--promoted node--view-mode-full""><div class=node__content><div class=""clearfix text-formatted field field--name-body field--type-text-with-summary field--label-hidden field__item""><p>Gerda Henkel Fellowship-Programme aims at supporting four German museums holding African collections – in Leipzig/Dresden/Herrnhut (Saxony), Hamburg, Cologne, and Stuttgart – in their engagement to decolonise their museum practice and to foster a new ethics of collaboration with the African continent. It offers 4 promising African candidates based on the continent an opportunity to become a team member of a German museum and to pursue their own exhibition, educational or research project and contribute to the overall development of the museum, while at the same time building on their professional experience.</p><p>The current call is for a fellowship at the Museum am Rothenbaum - Kulturen und Künste der Welt (<span class=caps>MARKK</span>) in Hamburg, starting in April 2023. </p><p><span class=caps>MARKK</span> offers:</p><ul><li><strong>A monthly stipend of 2875€ gross, for 24 months with the possibility of an extension for another 12 months.</strong></li><li>A travel budget of 2000€ to cultivate exchange and collaboration with the Gerda Henkel fellows at the three other museums and their host institutions.</li><li>A budget of 6000€ to complete research in Africa to support the project at the museum.</li><li>A project budget of 25,000 € to complete an exhibition programme, education or research project at the museum.</li></ul><p><span class=caps>MARKK</span> are specifically looking for a curator/scholar with experience in working with and researching cultural and art objects. The focus of the fellowship should ideally lie on collections from the Democratic Republic of the Congo (mostly from the Kasai and central regions) or Nigerian collections (mostly from the coastal areas or the Plateau regions). S/he will help to establish contacts for collaboration to contribute contemporary perspectives on the historic collections.</p><p>The fellow will be further involved in the conceptualisation of a new permanent exhibition and in <span class=caps>MARKK</span>’s overall process of rethinking museums and exhibition practices.</p></div></div></article></div>"
