"slug","title_en","title_fr","title_ar","excerpt_fr","excerpt_ar","sources","image_url","image_name","langs","published_at","extracted_at","deadline","rubrique_website","themes","organizations","content_fr","content_ar","content_html"
"encc-call-for-staff-exchange-training-and-mentoring-programme-lights-on-fuubeh","ENCC: Call for Staff Exchange, Training and Mentoring Programme, Lights On","","","","","https://on-the-move.org/news/encc-call-staff-exchange-training-and-mentoring-programme-lights-0","https://on-the-move.org/sites/default/files/styles/article_desktop_1x/public/news/2022-03/lights-on.jpeg?itok=Lqgy5DAj","","EN","2022-03-11 08:00:00","2022-12-26 11:35:01","2023-01-20 23:59:00","culture","culture","","","","<div id=block-otm-content class=""block block-system block-system-main-block""><article role=article about=/news/encc-call-staff-exchange-training-and-mentoring-programme-lights-0 class=""node node--type-news-calls node--promoted node--view-mode-full""><div class=node__content><div class=""clearfix text-formatted field field--name-body field--type-text-with-summary field--label-hidden field__item""><p>Lights On is a funded programme for young professionals under 35, working in cultural centres and other cultural organisations in Europe. It is a capacity building and process-oriented programme that unfolds over about 8 months. During this period, you should plan to be absent from work for about 12 days. <strong>The programme is largely funded by the <span class=caps>ENCC</span>. Your organisation covers only subsistence costs for the staff exchanges and, if it is not member of the <span class=caps>ENCC</span>, your travel costs to the launching seminar.</strong></p><p>A 5-day launch seminar, held in a different European city each year, is your first opportunity to meet with all the <span class=caps>LIGHTS</span> <span class=caps>ON</span> fellows and mentors. The seminar focuses on cultural management, professional self-development and soft skills, through a mix of training, workshops, coaching, peer-to-peer learning, and study visits to local networks and organisations. This year it will be held in Ostend, Belgium from 8-12 May 2023.</p><p>During the months following the seminar, you will travel to another participant’s organisation for at least 7 days, and host a participant in your organisation for the same amount of time.</p><p>From the moment of being selected to participate into the Lights On programme, up to project evaluation (about 8 months later), you will be supported and mentored by your programme trainers and the <span class=caps>ENCC</span> office. This makes Lights On a self-designable process, in which you can choose to pursue certain learning paths or research areas over a longer period of time, according to your needs and time capacity.</p></div></div></article></div>"
"european-theatre-convention-digital-communication-officer-germany-xyrgrj","European Theatre Convention: Digital Communication Officer (Germany)","","","","","https://on-the-move.org/news/european-theatre-convention-digital-communication-officer-germany-0","https://on-the-move.org/sites/default/files/styles/article_desktop_1x/public/news/2022-12/etc-conference.jpeg?itok=L19PK6Xn","","EN","2022-12-06 08:00:00","2022-12-26 11:35:02","2023-01-15 23:59:00","culture","culture","","","","<div id=block-otm-content class=""block block-system block-system-main-block""><article role=article about=/news/european-theatre-convention-digital-communication-officer-germany-0 class=""node node--type-news-calls node--promoted node--view-mode-full""><div class=node__content><div class=""clearfix text-formatted field field--name-body field--type-text-with-summary field--label-hidden field__item""><p>Founded in 1988 by three theatres in France, Germany and Belgium, the European Theatre Convention (<span class=caps>ETC</span>) has become Europe’s largest network for public theatres with 57 members from 31 countries. As a recognised strategic partner of the European Commission, <span class=caps>ETC</span> provides an international programme for European theatres, that consists of artistic international collaboration, professional training and advocacy activities. They promote European theatre as a vital platform for dialogue, democracy and interaction that responds to, reflects and engages with today’s diverse audiences and changing societies. With their work they pioneer European theatre that is sustainable, diverse and digital, increasing access to theatres in a post-covid world.</p><p>As part of a dynamic and small team, the Digital Communication Officer is key to further developing and implementing <span class=caps>ETC</span>’s communication strategy and its specific projects’ communication campaigns — with the goal to promote and increase visibility of the organisation’s activities internationally, in particular <span class=caps>ETC</span>’s current large scale European projects on sustainability and digitisation.</p><p>Responsibilities: </p><ul><li>Setting up, contributing to and optimising digital communication and social media campaigns, in order to deliver the <span class=caps>ETC</span> communication strategy, as directed by the Communication Manager and Executive Director, working closely with <span class=caps>ETC</span>’s team and external partners and providers.</li><li>Playing an active part in the design and delivery of communication campaigns related to <span class=caps>ETC</span>’s specific artistic, professional and advocacy activities and projects.</li><li>Implementing large scale changes and ongoing maintenance and updates to <span class=caps>ETC</span> website(s) and ensuring user experience is optimised, working with the external web agency; regular content update on website.</li><li>Maintenance and updating <span class=caps>ETC</span>’s <span class=caps>CRM</span> system.</li><li>Coordinating and creating social media products, incl. video, with a focus on developing engaging and visually attractive content, maintaining and coordinating content across social media channels, employing a harmonised editorial calendar.</li><li>Dissemination of press material and project publications - campaigns (print/online).</li><li>Support with graphic and editorial tasks for all <span class=caps>ETC</span> publications, social media, newsletters, annual reports, press releases, presentations.</li><li>Support in grant requests and project reporting for <span class=caps>ETC</span>’s funders and stakeholders (<span class=caps>EU</span> Commission, ministries, foundations etc.).</li><li>Liaise with <span class=caps>ETC</span>’s member and project theatres’ communication departments, external services and suppliers (graphic designer, <span class=caps>IT</span>, printing companies etc.), partners and stakeholders.</li></ul><p><span class=caps>ETC</span> offer a full-time unlimited employment contract, flexible working hours, 40h per week, and a work space with an office at the heart of Berlin, in one of Germany’s major theatres, with home office regulation (2-3 days per week). <strong>Monthly gross salary: 3000 <span class=caps>EUR</span></strong>, with social package consisting of 30 days of paid annual leave, 50% of your monthly public transport card for Berlin, a retirement scheme. The position is to be filled by 15 February 2023.</p></div></div></article></div>"
"roberto-cimetta-fund-general-fund-for-cultural-and-artistic-mobility-kpugnm","Roberto Cimetta Fund: General Fund for Cultural and Artistic Mobility","","","","","https://on-the-move.org/news/roberto-cimetta-fund-general-fund-cultural-and-artistic-mobility","https://on-the-move.org/sites/default/files/styles/article_desktop_1x/public/news/2022-12/roberto-cimetta_0.jpg?itok=VYPQnHis","","EN","2022-12-08 08:00:00","2022-12-26 11:35:03","2022-12-30 23:59:00","culture","culture","","","","<div id=block-otm-content class=""block block-system block-system-main-block""><article role=article about=/news/roberto-cimetta-fund-general-fund-cultural-and-artistic-mobility class=""node node--type-news-calls node--promoted node--view-mode-full""><div class=node__content><div class=""clearfix text-formatted field field--name-body field--type-text-with-summary field--label-hidden field__item""><p>In the framework of its mission to support mobility, the Roberto Cimetta Fund allocates on demand mobility grants, to meet the needs of cultural professionals and artists in the Mediterranean.</p><p>Aiming at promoting inclusive mobility, the Roberto Cimetta Fund gives priority to candidates with little access to mobility and/or who are poorly inserted into international cultural circuits. This call for applications for a travel grant is thus dedicated to women artists and cultural professionals from the southern and eastern shores of the Mediterranean, who are willing to travel within the southern Mediterranean region for south-south mobility (North Africa and the Middle East). The mobility must be completed before September 2023.</p><p>The purpose of the mobility must be one of the following:</p><ul><li>Preparation of a professional level project.</li><li>Participation in a research or creation residency.</li><li>Presence at a meeting of artists or professionals with the objective of networking between cultural, artistic and development actors.</li><li>Artistic and professional training/education (internships, masterclasses, exchanges, study trips) or participation as a speaker or a trainer.</li><li>Attendance at debates, conferences, seminars.</li></ul><p><strong>A lump sum will be awarded to the winners: between 500€ and 700€ per grant</strong>, allowing cover (at least partially) for the costs related to mobility in general: tickets, visas, accommodation, etc. This call will deliver between 12 and 20 grants. Grants will be allocated after the trip, upon presentation of supporting documents, a written report, and visuals.</p></div></div></article></div>"
"westway-lab-open-call-for-music-artists-portugal-swdlte","Westway Lab: Open Call for Music Artists (Portugal)","","","","","https://on-the-move.org/news/westway-lab-open-call-music-artists-portugal","https://on-the-move.org/sites/default/files/styles/article_desktop_1x/public/news/2022-12/westway-lab.jpg?itok=EdKfbLm_","","EN","2022-12-06 08:00:00","2022-12-26 11:35:04","2023-01-22 23:59:00","culture","culture","","","","<div id=block-otm-content class=""block block-system block-system-main-block""><article role=article about=/news/westway-lab-open-call-music-artists-portugal class=""node node--type-news-calls node--promoted node--view-mode-full""><div class=node__content><div class=""clearfix text-formatted field field--name-body field--type-text-with-summary field--label-hidden field__item""><p>Celebrating its 10th edition 12-15 April 2023, Westway Lab is Portugal’s showcase festival, international music conference, and artist residency annual event, promoted by A Oficina in Guimarães in partnership with <span class=caps>AMAEI</span>, the Portuguese Independent Music Trade Association, as well as the <span class=caps>WHY</span> Portugal export office and <span class=caps>GDA</span>, the Portuguese Artist Society for Performing Rights.</p><p>Each year, this unique event invites artists to showcase their music projects as part of the city showcases and/or also invites artists to participate in the co-creation residencies at the Candoso Creation Centre, a converted school that provides a week-long live and work environment, just outside the city of Guimarães.</p><p>Each year, 4 working groups of 3 artists (with at least 1 person in each group being Portuguese) work together the week before the festival to create new side-projects together. It is not a songwriting camp (there are no briefings or scripts): this is the absolute creative freedom to make new music together, with the only caveat being that each group must play a 30-minute live showcase on one of the first two days of the festival. These live premieres of each project will then be filmed and recorded to launch the new side project across Europe and the world. </p><p>Support for participants:</p><ul><li>Showcases: 300€ fee, dinner, and accommodation on the night of your showcase + <span class=caps>PRO</span> registration for the conferences.</li><li>Residencies 150€ fee per project (max. 2 people per project can apply), <strong>flights</strong>, transfers, meals, and accommodation at Candoso during the whole week; plus <span class=caps>PRO</span> registration for the conferences.</li></ul></div></div></article></div>"
"call-for-composers-for-iccs-young-talents-germany-czwctt","Call for Composers for ICCS Young Talents (Germany)","","","","","https://on-the-move.org/news/call-composers-iccs-young-talents-germany","https://on-the-move.org/sites/default/files/styles/article_desktop_1x/public/news/2022-12/iccs.jpg?itok=xnNXcEUi","","EN","2022-12-05 08:00:00","2022-12-26 11:35:05","2023-03-01 23:59:00","culture","culture","","","","<div id=block-otm-content class=""block block-system block-system-main-block""><article role=article about=/news/call-composers-iccs-young-talents-germany class=""node node--type-news-calls node--promoted node--view-mode-full""><div class=node__content><div class=""clearfix text-formatted field field--name-body field--type-text-with-summary field--label-hidden field__item""><p>Led by Ensemble Modern, the composer Iris ter Schiphorst and the conductor Bas Wiegers, the Composition Workshop <span class=caps>ICCS</span> young_talents will take place for the first time from 10-17 July 2023.</p><p>Young composers up to the age of 24 from all over Europe can apply with a concrete ensemble work. Within a one-week master course, participants will focus on rehearsing this work with Ensemble Modern under the baton of Bas Wiegers and <span class=caps>IEMA</span> fellow Xizi Wang. In addition to rehearsals, Ensemble Modern members will give workshops on subjects such as instrumental expertise, percussion, electronics, notation, and Ensemble sound.</p><p>The master course closes with a concert at the home of the German Ensemble Academy in Frankfurt, where the works will be performed. The final concert will be video-streamed and available online.</p><p>The call is open to candidates from Europe born in 1998 or after. <strong>The organisers cover costs for travel (2nd class train)</strong>, accommodation and meals.</p></div></div></article></div>"
"rixc-science-and-techno-ecologies-residency-programme-for-baltic-nordic-artists-latvia-eepuzn","RIXC: Science and Techno-Ecologies Residency Programme for Baltic-Nordic Artists (Latvia)","","","","","https://on-the-move.org/news/rixc-science-and-techno-ecologies-residency-programme-baltic-nordic-artists-latvia","https://on-the-move.org/sites/default/files/styles/article_desktop_1x/public/news/2022-12/rixc.jpeg?itok=FWFFw2SD","","EN","2022-12-05 08:00:00","2022-12-26 11:35:06","2023-01-15 23:59:00","culture","culture","","","","<div id=block-otm-content class=""block block-system block-system-main-block""><article role=article about=/news/rixc-science-and-techno-ecologies-residency-programme-baltic-nordic-artists-latvia class=""node node--type-news-calls node--promoted node--view-mode-full""><div class=node__content><div class=""clearfix text-formatted field field--name-body field--type-text-with-summary field--label-hidden field__item""><p><span class=caps>RIXC</span> - Center for New Media Culture is announcing an open call for its new residency programme for Baltic and Nordic artists who work on the edge of art, science and techno-ecologies, exploring the complex relations between human, nature and digital technologies, and focusing on new concepts such as ‘naturecultures’, ‘sensing environments’, ‘living technologies’, ‘terrestrial coexistence’, ‘naturally / artificial intelligences’, which recently have been re-examined at the heart of our society.</p><p>Three Art, Science and Techno-Ecologies residencies, each lasting two months and targeting Baltic and Nordic artists, will take place at <span class=caps>RIXC</span> in Riga, Latvia, supported by <span class=caps>NCP</span> (Nordic Culture Point). The three fully-funded Baltic-Nordic Artist Residencies will also include a trip and short-stay visits to <span class=caps>RIXC</span> Fields residency (in rural area) and their partner location – at the Irbene Radiotelescope.</p><p>Applications are open in two rounds: </p><ul><li>1 March – 30 April 2023 or 1 October – 20 November 2023. Deadline: 15 January 2023.</li><li>1 February 2024 – 31 March 2024. Deadline: 15 October 2023.</li></ul><p>Artists will be granted a fee of 3000 <span class=caps>EUR</span> for each two-month residency. <strong>Selected artists will also receive free accommodation, travel costs</strong>, local transportation costs, technical assistance, and other production costs related to public presentation. </p><p>As a result of the residency, the organisers expect that new artwork (installation, exhibition, performance) will be produced with a public presentation at the <span class=caps>RIXC</span> Gallery.</p><p>Applications are welcome from both established and emerging individual artists as well as artist duos from Baltic or Nordic countries. The organisers will primarily accept those applications in which artists express their interest in producing new ‘techno-ecological’ artworks, as well as exhibiting or publicly presenting their work, getting engaged with local artists, scientists and communities, and getting involved in other <span class=caps>RIXC</span> activities.</p></div></div></article></div>"
"staatliche-museen-zu-berlin-residency-for-visual-artists-and-designers-for-the-discovering-the-west-exhibition-germany-vzaxqp","Staatliche Museen zu Berlin: Residency for Visual Artists and Designers for the ‘Discovering the West’ Exhibition (Germany)","","","","","https://on-the-move.org/news/staatliche-museen-zu-berlin-residency-visual-artists-and-designers-discovering-west-exhibition","https://on-the-move.org/sites/default/files/styles/article_desktop_1x/public/news/2022-12/berlin-museum.jpeg?itok=2NUKhPLw","","EN","2022-12-02 08:00:00","2022-12-26 11:35:07","2023-01-06 23:59:00","culture","culture","","","","<div id=block-otm-content class=""block block-system block-system-main-block""><article role=article about=/news/staatliche-museen-zu-berlin-residency-visual-artists-and-designers-discovering-west-exhibition class=""node node--type-news-calls node--promoted node--view-mode-full""><div class=node__content><div class=""clearfix text-formatted field field--name-body field--type-text-with-summary field--label-hidden field__item""><p>The Ethnologisches Museum (Ethnological Museum) and the Museum für Asiatische Kunst (Asian Art Museum) of the Staatliche Museen zu Berlin (National Museums in Berlin) invite visual artists and designers to engage with the exhibition ‘Discovering the West’ in the galleries on North Africa, West and Central Asia at the Humboldt Forum for a period of three months in the first half of 2023.</p><p>The exhibition ‘Discovering the West’ deals with the reception, appropriation and reinterpretation of ideas associated with the ‘West’ in the Ottoman and Persian Empires at the end of the 19th century. Reports from the world exhibitions in Vienna and Paris were received with interest, but also critically in Tehran, Istanbul, Damascus or Cairo. Using the examples of urban redevelopment, fashion and furniture design, the exhibition focuses on how the new impressions took shape in the material and visual cultures of these cosmopolitan urban centres and how they led to concrete and far-reaching political steps. Changes in gender roles and social change are also manifest in the objects.</p><p>As part of the residency, artists are invited to engage with the themes and objects of the exhibition and explore their meanings for the 21st century. In doing so, the creative and material aspects of the works could be considered as well as their inherent transcultural or political underpinnings. The manifold connections in the fields of art and politics, the views of the ‘West’, but also the new political alliances emerging with the independence movements could be further starting points. </p><p>The residency includes:</p><ul><li>A stipend of 8500€ (including taxes and health insurance).</li><li><strong>Travel expenses all-inclusive to/from and in Berlin (including visa fees and possible corona tests: 1500€).</strong></li><li>Production budget depending on the project and possible purchase.</li><li>A small working space, access to the museum’s object and photo collection, archive and library, sound studio.</li><li>Curatorial supervision and technical and administrative support.</li></ul></div></div></article></div>"
"little-islands-festival-open-call-for-site-specific-projects-greece-cxpejp","Little Islands Festival: Open Call for Site-Specific Projects (Greece)","","","","","https://on-the-move.org/news/little-islands-festival-open-call-site-specific-projects-greece","https://on-the-move.org/sites/default/files/styles/article_desktop_1x/public/news/2022-12/little-islands-festival.jpg?itok=mq02-N_E","","EN","2022-12-02 08:00:00","2022-12-26 11:35:08","2023-02-19 23:59:00","culture","culture","","","","<div id=block-otm-content class=""block block-system block-system-main-block""><article role=article about=/news/little-islands-festival-open-call-site-specific-projects-greece class=""node node--type-news-calls node--promoted node--view-mode-full""><div class=node__content><div class=""clearfix text-formatted field field--name-body field--type-text-with-summary field--label-hidden field__item""><p>The 5th Little Islands Festival, starting from Sikinos, invites new media and performing arts artists to submit proposals that engage with ecology, anthropology, and science in the enduring dialogue about the relationship between humanity and nature. The island frontier, which like life itself emerges from the liquid element, becomes the principal space for exploring modern contradictions of human geography through art.</p><p>This next edition of Litltle Islands Festival will take place for 4-6 days between mid-July and mid-August of 2023. The organisers are calling for: </p><ul><li>Site-specific projects that explore cultural heritage in relation to the natural environment of Sikinos and the Cyclades in general: windmills, threshing floors, rural dwellings, dry stone walls, terraces, sacred and archaeological sites.</li><li>Works inspired by traditions, rituals, myths, customs in conversation with nature. Works that explore movements and directions such as: Environmental Sociology, Eco-anarchism, Ecofeminism, Eco-communalism, Deep Ecology.</li><li>Artistic practices with an emphasis on participation.</li><li>Artistic workshops for children and adults on environmental awareness.</li></ul><p>The festival is also opening applications for the <span class=caps>LIF</span> Residency and Research Programme 2023 in which participants will be hosted in Sikinos to create works inspired by the natural and cultural landscape of the island.</p><p>Applications are open to artists from Greece and abroad, art groups, young creatives, performers, filmmakers, musicians, dancers, architects, thinkers, activists, scientists, technologists, curators, educators and other creatives working in the field of hybrid arts/practices.</p><p>For participants in the live performance (live acts) and workshop categories the festival offers:</p><ul><li><strong>Airfare costs up to 200 euros per person.</strong></li><li>Accommodation costs.</li><li>Ferry ticket costs.</li><li>Coverage of technical equipment.</li></ul><p>Participants in the <span class=caps>LIF</span> Residency 2023 programme (1-2 weeks duration) will receive:</p><ul><li>Ferry ticket costs.</li><li>Accommodation costs.</li><li>Food supplies.</li><li>Assistance and general guidance on project set-up.</li></ul></div></div></article></div>"
